{
  "name": "MonoSynth",
  "description": "One-voice cycle~ with Pitch dial.",
  "device_type": "instrument",
  "devicewidth": 220.0,
  "openinpresentation": 1,
  "boxes": [
    {
      "box": {
        "id": "obj-1",
        "maxclass": "in",
        "numinlets": 1,
        "numoutlets": 1,
        "outlettype": [
          "signal"
        ],
        "patching_rect": [
          30.0,
          30.0,
          40.0,
          22.0
        ]
      }
    },
    {
      "box": {
        "id": "obj-2",
        "maxclass": "newobj",
        "numinlets": 2,
        "numoutlets": 1,
        "outlettype": [
          "signal"
        ],
        "text": "cycle~ 440",
        "patching_rect": [
          30.0,
          60.0,
          70.0,
          22.0
        ]
      }
    },
    {
      "box": {
        "id": "obj-3",
        "maxclass": "plugout~",
        "numinlets": 1,
        "numoutlets": 0,
        "patching_rect": [
          30.0,
          90.0,
          80.0,
          22.0
        ]
      }
    },
    {
      "box": {
        "id": "obj-4",
        "maxclass": "live.dial",
        "numinlets": 1,
        "numoutlets": 2,
        "outlettype": [
          "",
          "float"
        ],
        "parameter_enable": 1,
        "presentation": 1,
        "presentation_rect": [
          20.0,
          40.0,
          41.0,
          48.0
        ],
        "textcolor": [
          0.811764705882353,
          0.811764705882353,
          0.827450980392157,
          1.0
        ],
        "showname": 1,
        "shownumber": 1,
        "saved_attribute_attributes": {
          "valueof": {
            "parameter_longname": "Pitch",
            "parameter_shortname": "Pitch",
            "parameter_type": 0,
            "parameter_mmin": 20.0,
            "parameter_mmax": 127.0,
            "parameter_initial_enable": 1,
            "parameter_initial": [
              60.0
            ],
            "parameter_unitstyle": 0
          }
        },
        "patching_rect": [
          30.0,
          120.0,
          41.0,
          48.0
        ]
      }
    },
    {
      "box": {
        "id": "obj-5",
        "maxclass": "newobj",
        "numinlets": 1,
        "numoutlets": 1,
        "outlettype": [
          "float"
        ],
        "text": "mtof",
        "patching_rect": [
          30.0,
          176.0,
          40.0,
          22.0
        ]
      }
    },
    {
      "box": {
        "id": "obj-6",
        "maxclass": "sig~",
        "numinlets": 1,
        "numoutlets": 1,
        "outlettype": [
          "signal"
        ],
        "patching_rect": [
          30.0,
          206.0,
          37.0,
          22.0
        ]
      }
    }
  ],
  "lines": [
    {
      "patchline": {
        "source": [
          "obj-2",
          0
        ],
        "destination": [
          "obj-3",
          0
        ]
      }
    },
    {
      "patchline": {
        "source": [
          "obj-4",
          1
        ],
        "destination": [
          "obj-5",
          0
        ]
      }
    },
    {
      "patchline": {
        "source": [
          "obj-5",
          0
        ],
        "destination": [
          "obj-6",
          0
        ]
      }
    },
    {
      "patchline": {
        "source": [
          "obj-6",
          0
        ],
        "destination": [
          "obj-2",
          0
        ]
      }
    }
  ]
}
