{
  "name": "MidiArp",
  "description": "MIDI note through metro + Rate/Octaves controls.",
  "device_type": "midi_effect",
  "devicewidth": 220.0,
  "openinpresentation": 1,
  "boxes": [
    {
      "box": {
        "id": "obj-1",
        "maxclass": "midiin",
        "numinlets": 1,
        "numoutlets": 1,
        "outlettype": [
          ""
        ],
        "patching_rect": [
          30.0,
          30.0,
          80.0,
          22.0
        ]
      }
    },
    {
      "box": {
        "id": "obj-2",
        "maxclass": "midiout",
        "numinlets": 1,
        "numoutlets": 0,
        "patching_rect": [
          30.0,
          60.0,
          80.0,
          22.0
        ]
      }
    },
    {
      "box": {
        "id": "obj-3",
        "maxclass": "newobj",
        "numinlets": 2,
        "numoutlets": 1,
        "outlettype": [
          "bang"
        ],
        "text": "metro 250",
        "patching_rect": [
          30.0,
          90.0,
          63.0,
          22.0
        ]
      }
    },
    {
      "box": {
        "id": "obj-4",
        "maxclass": "live.dial",
        "numinlets": 1,
        "numoutlets": 2,
        "outlettype": [
          "",
          "float"
        ],
        "parameter_enable": 1,
        "presentation": 1,
        "presentation_rect": [
          20.0,
          40.0,
          41.0,
          48.0
        ],
        "textcolor": [
          0.811764705882353,
          0.811764705882353,
          0.827450980392157,
          1.0
        ],
        "showname": 1,
        "shownumber": 1,
        "saved_attribute_attributes": {
          "valueof": {
            "parameter_longname": "Rate",
            "parameter_shortname": "Rate",
            "parameter_type": 0,
            "parameter_mmin": 50.0,
            "parameter_mmax": 2000.0,
            "parameter_initial_enable": 1,
            "parameter_initial": [
              250.0
            ],
            "parameter_unitstyle": 3
          }
        },
        "patching_rect": [
          30.0,
          120.0,
          41.0,
          48.0
        ]
      }
    },
    {
      "box": {
        "id": "obj-5",
        "maxclass": "live.dial",
        "numinlets": 1,
        "numoutlets": 2,
        "outlettype": [
          "",
          "float"
        ],
        "parameter_enable": 1,
        "presentation": 1,
        "presentation_rect": [
          77.0,
          40.0,
          41.0,
          48.0
        ],
        "textcolor": [
          0.811764705882353,
          0.811764705882353,
          0.827450980392157,
          1.0
        ],
        "showname": 1,
        "shownumber": 1,
        "saved_attribute_attributes": {
          "valueof": {
            "parameter_longname": "Octaves",
            "parameter_shortname": "Octaves",
            "parameter_type": 0,
            "parameter_mmin": 1.0,
            "parameter_mmax": 4.0,
            "parameter_initial_enable": 1,
            "parameter_initial": [
              2.0
            ],
            "parameter_unitstyle": 0
          }
        },
        "patching_rect": [
          30.0,
          176.0,
          41.0,
          48.0
        ]
      }
    }
  ],
  "lines": [
    {
      "patchline": {
        "source": [
          "obj-1",
          0
        ],
        "destination": [
          "obj-2",
          0
        ]
      }
    }
  ]
}
