{
  "name": "MyAudioEffect",
  "description": "Audio effect stub — extend boxes/lines for DSP (template).",
  "device_type": "audio_effect",
  "devicewidth": 220.0,
  "openinpresentation": 1,
  "boxes": [
    {
      "box": {
        "id": "obj-in",
        "maxclass": "plugin~",
        "numinlets": 1,
        "numoutlets": 1,
        "outlettype": ["signal"],
        "patching_rect": [30.0, 30.0, 80.0, 22.0]
      }
    },
    {
      "box": {
        "id": "obj-out",
        "maxclass": "plugout~",
        "numinlets": 1,
        "numoutlets": 0,
        "patching_rect": [30.0, 200.0, 80.0, 22.0]
      }
    },
    {
      "box": {
        "id": "obj-dial",
        "maxclass": "live.dial",
        "numinlets": 1,
        "numoutlets": 2,
        "outlettype": ["", "float"],
        "parameter_enable": 1,
        "patching_rect": [120.0, 100.0, 41.0, 48.0],
        "presentation": 1,
        "presentation_rect": [20.0, 40.0, 41.0, 48.0],
        "textcolor": [0.811764705882353, 0.811764705882353, 0.827450980392157, 1.0],
        "showname": 1,
        "shownumber": 1,
        "saved_attribute_attributes": {
          "valueof": {
            "parameter_longname": "Mix",
            "parameter_shortname": "Mix",
            "parameter_type": 0,
            "parameter_mmin": 0.0,
            "parameter_mmax": 100.0,
            "parameter_initial_enable": 1,
            "parameter_initial": [100.0],
            "parameter_unitstyle": 1
          }
        }
      }
    }
  ],
  "lines": [
    {
      "patchline": {
        "source": ["obj-in", 0],
        "destination": ["obj-out", 0]
      }
    }
  ]
}
